symbol;name;currency
"MXF";"CI First Asset Can-Materials Covered Call ETF Common";"CAD"
"MXI";"iShares Global Materials ETF";"USD"
"MYY";"ProShares Short MidCap400";"USD"
"MZZ";"ProShares UltraShort MidCap400";"USD"
"NACP";"Impact Shares Trust I - Impact Shares NAACP Minority Empowerment ETF";"USD"
"NAIL";"Direxion Daily Homebuilders & Supplies Bull 3X Shares";"USD"
"NANR";"SPDR S&P North American Natural Resources ETF";"USD"
"NDQ";"BetaShares NASDAQ 100 ETF";"AUD"
"NEAR";"iShares Short Maturity Bond ETF";"USD"
"NEED";"Direxion Daily Cnsmr Staples Bull 3XShrs";"USD"
"NERD";"Roundhill BITKRAFT Esports & Digital Entertainment ETF";"USD"
"NETL";"Fundamental Income Net Lease Real Estate ETF";"USD"
"NFLT";"Virtus Newfleet Multi-Sector Bond ETF";"USD"
"NFRA";"FlexShares STOXX Global Broad Infrastructure Index Fund";"USD"
"NFTY";"First Trust India NIFTY 50 Equal Weight ETF";"USD"
"NGE";"Global X MSCI Nigeria ETF";"USD"
"NIB";"iPath Bloomberg Cocoa Subindex Total Return";"USD"
"NICK";"WisdomTree Nickel";"EUR"
"NICK";"WisdomTree Nickel";"USD"
"NJAN";"Innovator Nasdaq-100 Power Buffer ETF - January";"USD"
"NLR";"VanEck Vectors Uranium+Nuclear Energy ETF";"USD"
"NOBL";"ProShares S&P 500 Dividend Aristocrats ETF";"USD"
"NOCT";"Innovator Nasdaq-100 Power Buffer ETF";"USD"
"NORW";"Global X MSCI Norway ETF";"USD"
"NRGD";"MicroSectors U.S. Big Oil Index -3X Inverse Leveraged ETNs";"USD"
"NTSX";"WisdomTree 90/60 U.S. Balanced Fund";"USD"
"NUAG";"Nuveen Enhanced Yield U.S. Aggregate Bond ETF";"USD"
"NUBD";"Nuveen ESG U.S. Aggregate Bond ETF";"USD"
"NUDM";"Nuveen ESG International Developed Markets Equity ETF";"USD"
"NUEM";"Nuveen ESG Emerging Markets Equity ETF";"USD"
"NUGT";"Direxion Daily Gold Miners Index Bull 3X Shares";"USD"
"NUHY";"Nuveen ESG High Yield Corporate Bond ETF";"USD"
"NULC";"Nuveen ESG Large-Cap ETF";"USD"
"NULG";"Nuveen ESG Large-Cap Growth ETF";"USD"
"NULV";"Nuveen ESG Large-Cap Value ETF";"USD"
"NUMG";"Nuveen ESG Mid-Cap Growth ETF";"USD"
"NUMV";"Nuveen ESG Mid-Cap Value ETF";"USD"
"NURE";"Nuveen Short-Term REIT ETF";"USD"
"NUSA";"Nuveen Enhanced Yield 1-5 Year U.S. Aggregate Bond ETF";"USD"
"NUSC";"Nuveen ESG Small-Cap ETF";"USD"
"NUSI";"Nationwide Risk-Managed Income ETF";"USD"
"NXTG";"First Trust IndXX NextG ETF";"USD"
"NYF";"iShares New York Muni Bond ETF";"USD"
"OBOR";"KraneShares MSCI One Belt One Road Index ETF";"USD"
"OCIO";"ClearShares OCIO ETF";"USD"
"OEF";"iShares S&P 100 ETF";"USD"
"OEUR";"O'Shares FTSE Europe Quality Dividend ETF";"USD"
"OFSSZ";"OFS Capital Corporation - 6.50%";"USD"
"OGIG";"OSI ETF Trust - O'Shares Global Internet Giants ETF";"USD"
"OIH";"VanEck Vectors Oil Services ETF";"USD"
"OILK";"ProShares K-1 Free Crude Oil Strategy ETF";"USD"
"OLD";"The Long-Term Care ETF";"USD"
"OLEM";"iPath Pure Beta Crude Oil ETN";"USD"
"OMFL";"Invesco Russell 1000 Dynamic Multifactor ETF";"USD"
"OMFS";"Invesco Russell 2000 Dynamic Multifactor ETF";"USD"
"ONEO";"SPDR Russell 1000 Momentum Focus ETF";"USD"
"ONEQ";"Fidelity NASDAQ Composite Index Tracking Stock Fund";"USD"
"ONEV";"SPDR Russell 1000 Low Volatility Focus ETF";"USD"
"ONEY";"SPDR Russell 1000 Yield Focus ETF";"USD"
"ONLN";"ProShares Online Retail ETF";"USD"
"OPER";"ClearShares Ultra-Short Maturity ETF";"USD"
"OSCV";"Opus Small Cap Value Plus ETF";"USD"
"OUNZ";"VanEck Merk Gold Trust";"USD"
"OUSA";"O'Shares FTSE U.S. Quality Dividend ETF";"USD"
"OUSM";"OSI ETF Trust - O'Shares FTSE Russell Small Cap Quality Dividend ETF";"USD"
"OVB";"Overlay Shares Core Bond ETF";"USD"
"OVF";"Overlay Shares Foreign Equity ETF";"USD"
"OVL";"Overlay Shares Large Cap Equity ETF";"USD"
"OVM";"Overlay Shares Municipal Bond ETF";"USD"
"OVS";"Overlay Shares Small Cap Equity ETF";"USD"
"PAC";"BNP Paribas Easy MSCI Pacific ex Japan ex CW UCITS ETF Cap";"EUR"
"PAK";"Global X MSCI Pakistan ETF";"USD"
"PALL";"Aberdeen Standard Physical Palladium Shares ETF";"USD"
"PAPR";"Innovator S&P 500 Power Buffer ETF - April New";"USD"
"PASS";"Direxion Daily Cnsmr Discret Bear 3XShrs";"USD"
"PAUG";"Innovator S&P 500 Power Buffer ETF - August";"USD"
"PAVE";"Global X U.S. Infrastructure Development ETF";"USD"
"PAWZ";"ProShares Pet Care ETF";"USD"
"PAXX";"Platinum Asia Fund ETF";"AUD"
"PBB";"Prospect Capital Corporation NT 061524";"USD"
"PBD";"Purpose Total Return Bond Fund Series ETF";"CAD"
"PBD";"Invesco Global Clean Energy ETF";"USD"
"PBDM";"Invesco PureBeta FTSE Developed ex-North America ETF";"USD"
"PBE";"Invesco Exchange-Traded Fund Trust - Invesco Dynamic Biotechnology & Genome ETF";"MXN"
"PBE";"Invesco Dynamic Biotechnology & Genome ETF";"USD"
"PBEE";"Invesco PureBeta FTSE Emerging Markets ETF";"USD"
"PBI";"Purpose Best Ideas Fund Series ETF";"CAD"
"PBJ";"Invesco Dynamic Food & Beverage ETF";"USD"
"PBND";"Invesco PureBeta US Aggregate Bond ETF";"USD"
"PBP";"Invesco S&P 500 BuyWrite ETF";"USD"
"PBS";"Invesco Dynamic Media ETF";"USD"
"PBSM";"Invesco PureBeta MSCI USA Small Cap ETF";"USD"
"PBTP";"Invesco PureBeta 0-5 Yr US TIPS ETF";"USD"
"PBUS";"Invesco PureBeta MSCI USA ETF";"USD"
"PBW";"Invesco WilderHill Clean Energy ETF";"USD"
"PBY";"Prospect Capital Corporation";"USD"
"PCEF";"Invesco Exchange-Traded Fund Trust II - Invesco CEF Income Composite ETF";"MXN"
"PCEF";"Invesco CEF Income Composite ETF";"USD"
"PCY";"Invesco Exchange-Traded Fund Trust II - Invesco Emerging Markets Sovereign Debt ETF";"USD"
"PDBC";"Invesco Optimum Yield Diversified Commodity Strategy No K-1 ETF";"USD"
"PDEC";"Innovator S&P 500 Power Buffer ETF - December";"USD"
"PDIV";"Purpose Enhanced Dividend Fund ETF shares";"CAD"
"PDN";"Invesco FTSE RAFI Developed Markets ex-U.S. Small-Mid ETF";"USD"
"PDP";"Invesco DWA Momentum ETF";"USD"
"PEJ";"Invesco Dynamic Leisure and Entertainment ETF";"USD"
"PEX";"ProShares Global Listed Private Equity ETF";"USD"
"PEY";"Invesco High Yield Equity Dividend Achievers ETF";"USD"
"PEZ";"Invesco DWA Consumer Cyclicals Momentum ETF";"USD"
"PFEB";"Innovator S&P 500 Power Buffer ETF - February";"USD"
"PFF";"iShares Preferred and Income Securities ETF";"MXN"
"PFF";"iShares Preferred and Income Securities ETF";"USD"
"PFFA";"Virtus InfraCap U.S. Preferred Stock ETF";"USD"
"PFFD";"Global X U.S. Preferred ETF";"USD"
"PFFR";"ETFis Series Trust I - InfraCap REIT Preferred ETF";"USD"
"PFI";"Invesco DWA Financial Momentum ETF";"USD"
"PFIG";"Invesco Exchange-Traded Fund Trust II - Invesco Fundamental Investment Grade Corporate Bond ETF";"USD"
"PFL";"Invesco 1-3 Year Laddered Floating Rate Note Index ETF";"CAD"
"PFLD";"AAM Low Duration Preferred and Income Securities ETF";"USD"
"PFM";"Invesco Dividend Achievers ETF";"USD"
"PFXF";"VanEck Vectors Preferred Securities ex Financials ETF";"USD"
"PGAL";"Global X MSCI Portugal ETF";"USD"
"PGF";"Invesco Financial Preferred ETF";"USD"
"PGHY";"Invesco Exchange-Traded Fund Trust II - Invesco Global Short Term High Yield Bond ETF";"USD"
"PGJ";"Invesco Golden Dragon China ETF";"USD"
"PGX";"Invesco Exchange-Traded Fund Trust II - Invesco Preferred ETF";"MXN"
"PGX";"Invesco Preferred ETF";"USD"
"PHB";"Invesco Exchange-Traded Fund Trust II - Invesco Fundamental High Yield Corporate Bond ETF";"USD"
"PHDG";"Invesco S&P 500 Downside Hedged ETF";"USD"
"PHG";"Lyxor Index Fund - Lyxor STOXX Europe 600 Personal & Household Goods UCITS ETF Acc";"EUR"
"PHG";"Lyxor Index Fund - Lyxor STOXX Europe 600 Personal & Household Goods UCITS ETF Acc";"EUR"
"PHO";"Invesco Water Resources ETF";"USD"
"PHYL";"PGIM Active High Yield Bond ETF";"USD"
"PICB";"Invesco International Corporate Bond ETF";"USD"
"PICK";"iShares, Inc. - iShares MSCI Global Metals & Mining Producers ETF";"USD"
"PID";"Invesco International Dividend Achievers ETF";"USD"
"PID";"Purpose International Dividend Fund Series ETF";"CAD"
"PIE";"Invesco DWA Emerging Markets Momentum ETF";"USD"
"PILL";"Direxion Daily Pharmaceutical & Medical Bull 3X Shares ETF";"USD"
"PIN";"Purpose Monthly Income Fund Series ETF";"CAD"
"PIN";"Invesco India ETF";"USD"
"PINC";"Purpose Multi-Asset Income Fund ETF";"CAD"
"PIO";"Invesco Global Water ETF";"USD"
"PIXX";"Platinum International Fund ETF";"AUD"
"PIZ";"Invesco DWA Developed Markets Momentum ETF";"USD"
"PJAN";"Innovator S&P 500 Power Buffer ETF January";"USD"
"PJP";"Invesco Dynamic Pharmaceuticals ETF";"USD"
"PJUL";"Innovator ETFs Trust - Innovator S&P 500 Power Buffer ETF - July";"USD"
"PJUN";"Innovator S&P 500 Power Buffer ETF - New";"USD"
"PKB";"Invesco Dynamic Building & Construction ETF";"USD"
"PKW";"Invesco BuyBack Achievers ETF";"USD"
"PLAT";"WisdomTree Modern Tech Platforms Fund";"USD"
"PLCY";"EventShares U.S. Legislative Opportunities ETF";"USD"
"PLTM";"GraniteShares Platinum Trust";"USD"
"PLUS";"VanEck Vectors Australian Corporate Bond Plus ETF";"AUD"
"PLW";"Invesco Exchange-Traded Fund Trust II - Invesco 1-30 Laddered Treasury ETF";"USD"
"PMM";"Purpose Multi-Strategy Market Neutral Fund Series ETF";"CAD"
"PMOM";"Principal Sustainable Momentum Index ETF";"USD"
"PNOV";"Innovator S&P 500 Power Buffer ETF - November";"USD"
"PNQI";"Invesco NASDAQ Internet ETF";"USD"
"POCT";"Innovator S&P 500 Power Buffer ETF - October";"USD"
"POTX";"Global X Cannabis ETF";"USD"
"PPA";"Invesco Aerospace & Defense ETF";"USD"
"PPDM";"PortfolioPlus Developed Markets ETF";"USD"
"PPH";"VanEck Vectors Pharmaceutical ETF";"USD"
"PPH";"VanEck Vectors ETF Trust - VanEck Vectors Pharmaceutical ETF";"MXN"
"PPLC";"PortfolioPlus S&P 500 ETF";"USD"
"PPLT";"Aberdeen Standard Physical Platinum Shares ETF";"USD"
"PPTY";"PPTY – U.S. Diversified Real Estate ETF";"USD"
"PRA";"Purpose Diversified Real Asset Fund Series ETF";"CAD"
"PREF";"VanEck Vectors Preferred US Equity UCITS ETF";"CHF"
"PREF";"Principal Spectrum Preferred Securities Active ETF";"USD"
"PRF";"Invesco FTSE RAFI US 1000 ETF";"USD"
"PRF";"VanEck Vectors Preferred US Equity UCITS ETF";"USD"
"PRFZ";"Invesco FTSE RAFI US 1500 Small-Mid ETF";"MXN"
"PRFZ";"Invesco FTSE RAFI US 1500 Small-Mid ETF";"USD"
"PRN";"Invesco DWA Industrials Momentum ETF";"USD"
"PRNT";"The 3D Printing ETF";"USD"
"PRS";"Prudential Financial, Inc. 5.62";"USD"
"PSA";"Purpose High Interest Savings ETF";"CAD"
"PSB";"Invesco 1-5 Year Laddered Investment Grade Corporate Bond Index ETF";"CAD"
"PSC";"Principal U.S. Small-Cap Multi-Factor Index ETF";"USD"
"PSCC";"Invesco S&P SmallCap Consumer Staples ETF";"USD"
"PSCD";"Invesco S&P SmallCap Consumer Discretionary ETF";"USD"
"PSCE";"Invesco S&P SmallCap Energy ETF";"USD"
"PSCF";"Invesco S&P SmallCap Financials ETF";"USD"
"PSCH";"Invesco S&P SmallCap Health Care ETF";"USD"
"PSCI";"Invesco S&P SmallCap Industrials ETF";"USD"
"PSCT";"Invesco S&P SmallCap Information Technology ETF";"USD"
"PSCU";"Invesco S&P SmallCap Utilities & Communication Services ETF";"USD"
"PSEP";"Innovator S&P 500 Power Buffer ETF - September";"USD"
"PSET";"Principal Price Setters Index ETF";"USD"
"PSI";"Invesco Dynamic Semiconductors ETF";"USD"
"PSJ";"Invesco Dynamic Software ETF";"USD"
"PSK";"SPDR Wells Fargo Preferred Stock ETF";"USD"
"PSL";"Invesco DWA Consumer Staples Momentum ETF";"USD"
"PSM";"Principal U.S. Small-MidCap Multi-Factor Core Index ETF";"USD"
"PSMB";"Invesco Balanced Multi-Asset Allocation ETF";"USD"
"PSMC";"Invesco Conservative Multi-Asset Allocation ETF";"USD"
"PSMG";"Invesco Growth Multi-Asset Allocation ETF";"USD"
"PSMM";"Invesco Moderately Conservative Multi-Asset Allocation ETF";"USD"
"PSP";"Invesco Global Listed Private Equity ETF";"USD"
"PSQ";"ProShares Short QQQ";"USD"
"PSR";"Invesco Active U.S. Real Estate Fund";"USD"
"PSRU";"Invesco FTSE RAFI UK 100 UCITS ETF";"GBp"
"PST";"ProShares UltraShort 7-10 Year Treasury";"USD"
"PTBD";"Pacer Trendpilot US Bond ETF";"USD"
"PTEU";"Pacer Trendpilot European Index ETF";"USD"
"PTF";"Invesco DWA Technology Momentum ETF";"USD"
"PTH";"Invesco DWA Healthcare Momentum ETF";"USD"
"PTIN";"Pacer Trendpilot International ETF";"USD"
"PTLC";"Pacer Trendpilot US Large Cap ETF";"USD"
"PTMC";"Pacer Trendpilot US Mid Cap ETF";"USD"
"PTMN";"Portman Ridge Finance Corporation";"USD"
"PTNQ";"Pacer Trendpilot 100 ETF";"USD"
"PUI";"Invesco DWA Utilities Momentum ETF";"USD"
"PULS";"PGIM Ultra Short Bond ETF";"USD"
"PUTW";"WisdomTree CBOE S&P 500 PutWrite Strategy Fund";"USD"
"PUTW";"WisdomTree CBOE S&P 500 PutWrite UCITS ETF USD Acc";"USD"
"PUTW";"WisdomTree CBOE S&P 500 PutWrite UCITS ETF USD Acc";"USD"
"PVAL";"Principal Contrarian Value Index ETF";"USD"
"PVI";"Invesco Exchange-Traded Fund Trust II - Invesco VRDO Tax-Free Weekly ETF";"USD"
"PWB";"Invesco Dynamic Large Cap Growth ETF";"USD"
"PWC";"Invesco Dynamic Market ETF";"USD"
"PWS";"Pacer WealthShield ETF";"USD"
"PWV";"Invesco Dynamic Large Cap Value ETF";"USD"
"PWZ";"Invesco California AMT-Free Municipal Bond ETF";"USD"
"PXE";"Invesco Dynamic Energy Exploration & Production ETF";"USD"
"PXF";"Invesco FTSE RAFI Developed Markets ex-U.S. ETF";"USD"
"PXH";"Invesco FTSE RAFI Emerging Markets ETF";"USD"
"PXI";"Invesco DWA Energy Momentum ETF";"USD"
"PXJ";"Invesco Dynamic Oil & Gas Services ETF";"USD"
"PXQ";"Invesco Dynamic Networking ETF";"USD"
"PY";"Principal Shareholder Yield Index ETF";"USD"
"PYS";"PPlus Trust Series RRD-1 RRD-1 CTF CL A";"USD"
"PYZ";"Invesco DWA Basic Materials Momentum ETF";"USD"
"PZA";"Invesco Exchange-Traded Fund Trust II - Invesco National AMT-Free Municipal Bond ETF";"USD"
"PZC";"Invesco FTSE RAFI Canadian Small-Mid Index ETF";"CAD"
"PZD";"Invesco Exchange-Traded Fund Trust - Invesco Cleantech ETF";"MXN"
"PZD";"Invesco Cleantech ETF";"USD"
"PZT";"Invesco New York AMT-Free Municipal Bond ETF";"USD"
"QABA";"First Trust NASDAQ ABA Community Bank Index Fund";"USD"
"QAI";"IQ Hedge Multi-Strategy Tracker ETF";"USD"
"QARP";"Xtrackers Russell 1000 US QARP ETF";"USD"
"QAT";"iShares MSCI Qatar ETF";"USD"
"QCLN";"First Trust NASDAQ Clean Edge Green Energy Index Fund";"USD"
"QDEF";"FlexShares Quality Dividend Defensive Index Fund";"USD"
"QDF";"FlexShares Quality Dividend Index Fund";"USD"
"QDIV";"iShares II plc - iShares MSCI USA Quality Dividend UCITS ETF";"USD"
"QDIV";"Global X S&P 500 Quality Dividend ETF";"USD"
"QDYN";"FlexShares Quality Dividend Dynamic Index Fund";"USD"
"QED";"IQ Hedge Event-Driven Tracker ETF";"USD"
"QEFA";"SPDR MSCI EAFE StrategicFactors ETF";"USD"
"QEMM";"SPDR MSCI Emerging Markets StrategicFactors ETF";"USD"
"QGRO";"American Century U.S. Quality Growth ETF";"USD"
"QGTA";"IQ Leaders GTAA Tracker ETF";"USD"
"QID";"ProShares UltraShort QQQ";"USD"
"QINT";"American Century Quality Diversified International ETF";"USD"
"QLC";"FlexShares US Quality Large Cap Index Fund";"USD"
"QLD";"ProShares Ultra QQQ";"USD"
"QLD";"ProShares Ultra QQQ";"MXN"
"QLTA";"iShares Aaa - A Rated Corporate Bond ETF";"USD"
"QLTA";"iShares Trust - iShares Aaa - A Rated Corporate Bond ETF";"MXN"
"QLV";"FlexShares US Quality Low Volatility Index Fund";"USD"
"QLVD";"FlexShares Developed Markets ex-US Quality Low Volatility Index Fund";"USD"
"QLVE";"FlexShares Emerging Markets Quality Low Volatility Index Fund";"USD"
"QMJ";"Direxion Shares ETF Trust - Direxion S&P 500 High Quality versus Low Quality ETF";"USD"
"QMN";"IQ Hedge Market Neutral Tracker ETF";"USD"
"QMOM";"Alpha Architect U.S. Quantitative Momentum ETF";"USD"
"QQEW";"First Trust NASDAQ-100 Equal Weighted Index Fund";"USD"
"QQH";"HCM Defender 100 Index ETF";"USD"
"QQQ";"Invesco QQQ Trust, Series 1";"MXN"
"QQQ";"Invesco QQQ Trust";"USD"
"QQQE";"Direxion NASDAQ-100 Equal Weighted Index Shares";"USD"
"QQXT";"First Trust NASDAQ-100 Ex-Technology Sector Index Fund";"USD"
"QRFT";"QRAFT AI-Enhanced U.S. Large Cap ETF";"USD"
"QSY";"WisdomTree U.S. Quality Shareholder Yield Fund";"USD"
"QTEC";"First Trust NASDAQ-100-Technology Sector Index Fund";"USD"
"QTUM";"Defiance Quantum ETF";"USD"
"QUAL";"iShares Edge MSCI USA Quality Factor ETF";"MXN"
"QUAL";"iShares Edge MSCI USA Quality Factor ETF";"USD"
"QUAL";"VanEck Vectors MSCI World ex Australia Quality ETF";"AUD"
"QUS";"AGFiQ Enhanced Core U.S. Equity ETF";"CAD"
"QUS";"BetaShares FTSE RAFI U.S. 1000 ETF";"AUD"
"QUS";"SPDR MSCI USA StrategicFactors ETF";"USD"
"QVAL";"Alpha Architect ETF Trust - Alpha Architect U.S. Quantitative Value ETF";"USD"
"QVCD";"QVC, Inc. 6.375% Senior Secured";"USD"
"QVM";"Arrow Investments Trust - Arrow QVM Equity Factor ETF";"USD"
"QWLD";"SPDR MSCI World StrategicFactors ETF";"USD"
"QYLD";"Global X NASDAQ 100 Covered Call ETF";"USD"
"RAAX";"VanEck Vectors Real Asset Allocation ETF";"USD"
"RAFE";"PIMCO RAFI ESG U.S. ETF PIMCO RAFI ESG U.S. ETF";"USD"
"RALS";"ProShares RAFI Long/Short";"USD"
"RAVI";"FlexShares Ready Access Variable Income Fund";"USD"
"RBOT";"Horizons Robotics and Automation Index ETF";"CAD"
"RBUS";"Nationwide Risk-Based U.S. Equity ETF";"USD"
"RCB";"Russell Investments Australian Select Corporate Bond ETF";"AUD"
"RCD";"Invesco S&P 500 Equal Weight Consumer Discretionary ETF";"USD"
"RCD";"RBC Quant Canadian Dividend Leaders ETF";"CAD"
"RDIV";"Invesco S&P Ultra Dividend Revenue ETF";"USD"
"RDOG";"ALPS REIT Dividend Dogs ETF";"USD"
"RDVY";"First Trust Rising Dividend Achievers ETF";"USD"
"REAL";"Amundi Index Solutions - Amundi FTSE EPRA Europe Real Estate UCITS ETF-C";"EUR"
"REAL";"Amundi Index Solutions - Amundi FTSE EPRA Europe Real Estate UCITS ETF-C";"EUR"
"RECS";"Columbia ETF Trust I - Columbia Research Enhanced Core ETF";"USD"
"REET";"iShares Global REIT ETF";"USD"
"REGL";"ProShares S&P MidCap 400 Dividend Aristocrats ETF";"USD"
"REIT";"Invesco S&P/TSX REIT Income Index ETF";"CAD"
"REK";"ProShares Short Real Estate";"USD"
"REM";"iShares Trust - iShares Mortgage Real Estate ETF";"MXN"
"REM";"iShares Mortgage Real Estate Capped ETF";"USD"
"REMX";"VanEck Vectors Rare Earth/Strategic Metals ETF";"USD"
"RENT";"AMP Capital Global Property Securities Fund Unhedged";"AUD"
"RETL";"Direxion Daily Retail Bull 3X Shares";"USD"
"REW";"ProShares UltraShort Technology";"USD"
"REW";"ProShares UltraShort Technology";"MXN"
"REZ";"iShares Residential Real Estate Capped ETF";"USD"
"RFAP";"First Trust RiverFront Dynamic Asia Pacific ETF";"USD"
"RFCI";"ALPS ETF Trust - Riverfront Dynamic Core Income ETF";"USD"
"RFDA";"RiverFront Dynamic US Dividend Advantage ETF";"USD"
"RFDI";"First Trust RiverFront Dynamic Developed International ETF";"USD"
"RFEM";"First Trust RiverFront Dynamic Emerging Markets ETF";"USD"
"RFEU";"First Trust RiverFront Dynamic Europe ETF";"USD"
"RFFC";"RiverFront Dynamic US Flex-Cap ETF";"USD"
"RFG";"Invesco S&P MidCap 400 Pure Growth ETF";"USD"
"RFUN";"ALPS ETF Trust - Riverfront Dynamic Unconstrained Income ETF";"USD"
"RFV";"Invesco S&P MidCap 400 Pure Value ETF";"USD"
"RGI";"Invesco S&P 500 Equal Weight Industrials ETF";"USD"
"RHS";"Invesco S&P 500 Equal Weight Consumer Staples ETF";"USD"
"RIG";"RBC Quant Global Infrastructure Leaders ETF";"CAD"
"RIGS";"RiverFront Strategic Income Fund";"USD"
"RILYI";"B. Riley Financial, Inc. - 6.87";"USD"
"RINC";"BetaShares Legg Mason Real Income Fund";"AUD"
"RINF";"ProShares Inflation Expectations ETF";"USD"
"RING";"iShares MSCI Global Gold Miners ETF";"USD"
"RIO";"MULTI UNITS LUXEMBOURG - Lyxor MSCI Brazil UCITS ETF";"EUR"
"RIT";"CI First Asset Canadian REIT ETF Common";"CAD"
"RJA";"ELEMENTS Linked to the Rogers International Commodity Index - Agriculture Total Return";"USD"
"RJI";"ELEMENTS Linked to the Rogers International Commodity Index - Total Return";"USD"
"RJN";"ELEMENTS Linked to the Rogers International Commodity Index - Energy Total Return";"USD"
"RJZ";"ELEMENTS Linked to the Rogers International Commodity Index - Metals Total Return";"USD"
"RLY";"SPDR SSgA Multi-Asset Real Return ETF";"USD"
"RNDM";"First Trust Developed International Equity Select ETF";"USD"
"RNDV";"First Trust US Equity Dividend Select ETF";"USD"
"RNEM";"First Trust Emerging Markets Equity Select ETF";"USD"
"RNLC";"First Trust Large Cap US Equity Select ETF";"USD"
"RNMC";"First Trust Mid Cap US Equity Select ETF";"USD"
"RNSC";"First Trust Small Cap US Equity Select ETF";"USD"
"ROAM";"Hartford Multifactor Emerging Markets ETF";"USD"
"ROBO";"ETFS ROBO Global Robotics and Automation ETF";"AUD"
"ROBO";"L&G ROBO Global Robotics and Automation UCITS ETF";"EUR"
"ROBO";"L&G ROBO Global Robotics and Automation UCITS ETF";"EUR"
"ROBO";"L&G ROBO Global Robotics and Automation UCITS ETF";"USD"
"ROBO";"L&G ROBO Global Robotics and Automation UCITS ETF";"CHF"
"ROBO";"Robo Global Robotics and Automation Index ETF";"USD"
"ROBT";"First Trust Nasdaq Artificial Intelligence and Robotics ETF";"USD"
"RODM";"Hartford Multifactor Developed Markets ";"USD"
"ROKT";"SPDR Kensho Final Frontiers ETF";"USD"
"ROLL";"iShares Bloomberg Roll Select Commodity Swap UCITS ETF";"USD"
"ROM";"ProShares Ultra Technology";"USD"
"ROMO";"Strategy Shares Newfound/ReSolve Robust Momentum ETF";"USD"
"ROOF";"IQ U.S. Real Estate Small Cap ETF";"USD"
"RORE";"Hartford Multifactor REIT ETF";"USD"
"ROSC";"Hartford Multifactor Small Cap ETF";"USD"
"ROUS";"Hartford Multifactor US Equity ETF";"USD"
"RPAR";"RPAR Risk Parity ETF";"USD"
"RPD";"RBC Quant European Dividend Leaders ETF";"CAD"
"RPG";"Invesco S&P 500 Pure Growth ETF";"USD"
"RPG";"Invesco S&P 500 Pure Growth ETF";"MXN"
"RPV";"Invesco S&P 500 Pure Value ETF";"USD"
"RQI";"RBC Target 2021 Corporate Bond Index ETF";"CAD"
"RSP";"Invesco S&P 500 Equal Weight ETF";"USD"
"RSP";"Invesco Exchange-Traded Fund Trust - Invesco S&P 500 Equal Weight ETF";"MXN"
"RSX";"VanEck Vectors Russia ETF";"USD"
"RSXJ";"VanEck Vectors Russia Small-Cap ETF";"USD"
"RTH";"VanEck Vectors ETF Trust - VanEck Vectors Retail ETF";"MXN"
"RTH";"VanEck Vectors Retail ETF";"USD"
"RTL";"Pacer Benchmark Retail Real Estate SCTR ETF";"USD"
"RTM";"Invesco S&P 500 Equal Weight Materials ETF";"USD"
"RUSL";"Direxion Daily Russia Bull 3X Shares";"USD"
"RVNU";"Xtrackers Municipal Infrastructure Revenue Bond ETF";"USD"
"RVRS";"Reverse Cap Weighted U.S. Large Cap ETF";"USD"
"RWDC";"Direxion MSCI Defensives Over Cyclicals ETF";"USD"
"RWED";"Direxion MSCI Emerging Over Developed Markets ETF";"USD"
"RWGV";"Direxion Russell 1000 Growth Over Value ETF";"USD"
"RWJ";"Invesco S&P SmallCap 600 Revenue ETF";"USD"
"RWK";"Invesco S&P MidCap 400 Revenue ETF";"USD"
"RWL";"Invesco S&P 500 Revenue ETF";"USD"
"RWM";"ProShares Short Russell2000";"USD"
"RWO";"SPDR Dow Jones Global Real Estate ETF";"USD"
"RWR";"SPDR Dow Jones REIT ETF";"USD"
"RWSL";"Direxion Russell Small Over Large Cap ETF";"USD"
"RWUI";"Direxion FTSE Russell US Over International ETF";"USD"
"RWVG";"Direxion Russell 1000 Value Over Growth ETF";"USD"
"RWX";"SPDR Dow Jones International Real Estate ETF";"USD"
"RWX";"CI First Asset MSCI International Low Risk Weighted ETF";"CAD"
"RXD";"ProShares UltraShort Health Care";"USD"
"RXD";"RBC Quant Emerging Markets Dividend Leaders ETF";"CAD"
"RXI";"iShares Trust - iShares Global Consumer Discretionary ETF";"MXN"
"RXI";"iShares Global Consumer Discretionary ETF";"USD"
"RXL";"ProShares Ultra Health Care";"USD"
"RYE";"Invesco S&P 500 Equal Weight Energy ETF";"USD"
"RYF";"Invesco S&P 500 Equal Weight Financials ETF";"USD"
"RYH";"Invesco S&P 500 Equal Weight Health Care ETF";"USD"
"RYJ";"Invesco Raymond James SB-1 Equity ETF";"USD"
"RYLD";"Global X Russell 2000 Covered Call ETF";"USD"
"RYT";"Invesco S&P 500 Equal Weight Technology ETF";"USD"
"RYU";"Invesco S&P 500 Equal Weight Utilities ETF";"USD"
"RYZZ";"RYZZ Managed Futures Strategy Plus ETF";"USD"
"RZG";"Invesco S&P SmallCap 600 Pure Growth ETF";"USD"
"RZV";"Invesco S&P SmallCap 600 Pure Value ETF";"USD"
"SAA";"ProShares Ultra SmallCap600";"USD"
"SAF";"Saratoga Investment Corp 6.25% ";"USD"
"SBB";"ProShares Short SmallCap600";"USD"
"SBIO";"Invesco NASDAQ Biotech UCITS ETF";"USD"
"SBIO";"Invesco NASDAQ Biotech UCITS ETF";"EUR"
"SBIO";"ALPS Medical Breakthroughs ETF";"USD"
"SBIO";"Invesco NASDAQ Biotech UCITS ETF";"EUR"
"SBM";"ProShares Short Basic Materials";"USD"
"SBT";"Silver Bullion Trust ETF Currency Hedged Units";"CAD"
"SCC";"ProShares UltraShort Consumer Services";"MXN"
"SCC";"ProShares UltraShort Consumer Services";"USD"
"SCHA";"Schwab U.S. Small-Cap ETF";"USD"
"SCHB";"Schwab U.S. Broad Market ETF";"USD"
"SCHC";"Schwab International Small-Cap Equity ETF";"USD"
"SCHD";"Schwab U.S. Dividend Equity ETF";"USD"
"SCHE";"Schwab Emerging Markets Equity ETF";"USD"
"SCHF";"Schwab International Equity ETF";"USD"
"SCHG";"Schwab U.S. Large-Cap Growth ETF";"USD"
"SCHH";"Schwab U.S. REIT ETF";"USD"
"SCHI";"Schwab 5-10 Year Corporate Bond ETF";"USD"
"SCHJ";"Schwab 1-5 Year Corporate Bond ETF";"USD"
"SCHK";"Schwab 1000 ETF";"USD"
"SCHM";"Schwab U.S. Mid-Cap ETF";"USD"
"SCHO";"Schwab Short-Term U.S. Treasury ETF";"USD"
"SCHP";"Schwab U.S. TIPS ETF";"USD"
"SCHQ";"Schwab Long-Term U.S. Treasury ETF";"USD"
"SCHR";"Schwab Intermediate-Term U.S. Treasury ETF";"USD"
"SCHV";"Schwab U.S. Large-Cap Value ETF";"USD"
"SCHX";"Schwab U.S. Large-Cap ETF";"USD"
"SCHZ";"Schwab U.S. Aggregate Bond ETF";"USD"
"SCID";"Global X Scientific Beta Europe ETF";"USD"
"SCIJ";"Global X Scientific Beta Japan ETF";"USD"
"SCIU";"Global X Scientific Beta US ETF";"USD"
"SCIX";"Global X Scientific Beta Asia ex-Japan ETF";"USD"
"SCJ";"iShares MSCI Japan Small-Cap ETF";"USD"
"SCO";"ProShares UltraShort Bloomberg Crude Oil";"USD"
"SCZ";"iShares MSCI EAFE Small-Cap ETF";"USD"
"SDCI";"USCF SummerHaven Dynamic Commodity Strategy No K-1 Fund";"USD"
"SDD";"ProShares UltraShort SmallCap600";"USD"
"SDEM";"Global X MSCI SuperDividend Emerging Markets ETF";"USD"
"SDG";"iShares MSCI Global Impact ETF";"USD"
"SDGA";"Impact Shares Sustainable Development Goals Global Equity ETF";"USD"
"SDIV";"Global X SuperDividend ETF";"USD"
"SDOG";"ALPS Sector Dividend Dogs ETF";"USD"
"SDOW";"ProShares UltraPro Short Dow30";"USD"
"SDP";"ProShares UltraShort Utilities";"USD"
"SDS";"ProShares UltraShort S&P500";"USD"
"SDVY";"First Trust SMID Cap Rising Dividend Achievers ETF";"USD"
"SDY";"SPDR S&P Dividend ETF";"USD"
"SDYL";"UBS ETRACS Monthly Pay 2xLeveraged S&P Dividend ETN";"USD"
"SEAC";"UBS ETF - MSCI World Socially Responsible UCITS ETF ";"EUR"
"SECT";"Main Sector Rotation ETF";"USD"
"SEED";"Evolve Marijuana Fund";"CAD"
"SEF";"ProShares Short Financials";"USD"
"SELF";"SelfWealth SMSF Leaders ETF";"AUD"
