symbol;name;currency
"IGRO";"iShares International Dividend Growth ETF";"USD"
"IGSB";"iShares Short-Term Corporate Bond ETF";"USD"
"IGSB";"iShares Trust - iShares Short-Term Corporate Bond ETF";"MXN"
"IGV";"iShares Expanded Tech-Software Sector ETF";"USD"
"IHAK";"iShares Cybersecurity and Tech ETF";"USD"
"IHD";"iShares S&P/ASX Dividend Opportunities ETF";"AUD"
"IHDG";"WisdomTree International Hedged Quality Dividend Growth Fund";"USD"
"IHDG";"WisdomTree International Hedged Quality Dividend Growth Fund";"MXN"
"IHE";"iShares U.S. Pharmaceuticals ETF";"USD"
"IHF";"iShares U.S. Healthcare Providers ETF";"USD"
"IHHFF";"iShares II plc.";"USD"
"IHHSF";"Ishares III Plc";"USD"
"IHI";"iShares U.S. Medical Devices ETF";"USD"
"IHI";"iShares Trust - iShares U.S. Medical Devices ETF";"MXN"
"IHSFF";"iShares II Public Limited Company - iShares $ TIPS UCITS ETF";"USD"
"IHY";"VanEck Vectors International High Yield Bond ETF";"USD"
"IIGD";"Invesco Investment Grade Defensive ETF";"USD"
"IIGF";"Intelligent Investor Aus Equity Growth Fund";"AUD"
"IIGV";"Invesco Investment Grade Value ETF";"USD"
"IIREF";"iShares MSCI";"USD"
"IJAN";"Innovator MSCI EAFE Power Buffer ETF January";"USD"
"IJH";"iShares Core S&P Mid-Cap ETF";"USD"
"IJH";"iShares S&P Mid-Cap ETF";"AUD"
"IJJ";"iShares S&P Mid-Cap 400 Value ETF";"USD"
"IJK";"iShares S&P Mid-Cap 400 Growth ETF";"MXN"
"IJK";"iShares S&P Mid-Cap 400 Growth ETF";"USD"
"IJR";"iShares S&P Small-Cap ETF";"AUD"
"IJR";"iShares Core S&P Small-Cap ETF";"USD"
"IJS";"iShares S&P Small-Cap 600 Value ETF";"USD"
"IJT";"iShares S&P Small-Cap 600 Growth ETF";"USD"
"IJUL";"Innovator MSCI EAFE Power Buffer ETF - July";"USD"
"ILB";"iShares Government Inflation ETF";"AUD"
"ILF";"iShares Latin America 40 ETF";"USD"
"ILTB";"iShares Core 10+ Year USD Bond ETF";"USD"
"IMLP";"iPath S&P MLP ETN";"USD"
"IMOM";"Alpha Architect International Quantitative Momentum ETF";"USD"
"IMPQ";"eInvest Future Impact Small Caps Fund";"AUD"
"IMSEF";"iShares II plc.";"USD"
"IMSIF";"iShares II plc.";"USD"
"IMTB";"iShares Core 5-10 Year USD Bond ETF";"USD"
"IMTM";"iShares Edge MSCI Intl Momentum Factor ETF";"USD"
"INCO";"Columbia India Consumer ETF";"USD"
"INDA";"iShares MSCI India ETF";"USD"
"INDA";"iShares Trust - iShares MSCI India ETF";"MXN"
"INDL";"Direxion Daily MSCI India Bull 3x Shares";"USD"
"INDO";"Multi Units Luxembourg - Lyxor MSCI Indonesia UCITS ETF";"EUR"
"INDO";"Lyxor MSCI Indonesia UCITS ETF Acc";"EUR"
"INDS";"Pacer Benchmark Industrial Real Estate SCTR ETF";"USD"
"INDY";"iShares Trust - iShares India 50 ETF";"MXN"
"INDY";"iShares India 50 ETF";"USD"
"INES";"Intelligent Investor Ethical Share Fund";"AUD"
"INFR";"iShares Global Infrastructure UCITS ETF USD ";"EUR"
"INFR";"iShares Global Infrastructure UCITS ETF USD ";"USD"
"INFR";"Legg Mason Global Infrastructure ETF";"USD"
"INFR";"iShares Global Infras ETF USD Dist";"GBp"
"INFR";"iShares Global Infrastructure UCITS ETF USD ";"EUR"
"INFU";"Lyxor US$ 10Y Inflation Expectations UCITS ETF - C-USD";"EUR"
"INIF";"Intelligent Investor Aus Equity Income Fund";"AUD"
"INKM";"SPDR SSgA Income Allocation ETF";"USD"
"INR";"Lyxor MSCI India UCITS ETF";"EUR"
"INR";"Lyxor MSCI India UCITS ETF";"EUR"
"INS";"Lyxor STOXX Europe 600 Insurance UCITS ETF";"EUR"
"INS";"Lyxor STOXX Europe 600 Insurance UCITS ETF";"EUR"
"INS";"Lyxor Index Fund - Lyxor STOXX Europe 600 Insurance UCITS ETF Acc";"EUR"
"INTF";"iShares Edge MSCI Multifactor Intl ETF";"USD"
"INTL";"WisdomTree Artificial Intelligence UCITS ETF - USD Acc";"GBp"
"IOO";"iShares Global 100 ETF";"USD"
"IOO";"iShares Global 100 ETF ";"AUD"
"IOOXF";"iShares Core Canadian Long Term Bond Index ETF";"USD"
"IOZ";"iShares Core S&P/ASX 200 ETF";"AUD"
"IPAC";"iShares Core MSCI Pacific ETF";"USD"
"IPAY";"ETFMG Prime Mobile Payments ETF";"USD"
"IPFF";"iShares International Preferred Stock ETF";"USD"
"IPKW";"Invesco International BuyBack Achievers ETF";"USD"
"IPO";"Renaissance IPO ETF";"USD"
"IPOS";"Renaissance International IPO ETF";"USD"
"IPPIF";"iShares II plc.";"USD"
"IQDE";"FlexShares International Quality Dividend Defensive Index Fund";"USD"
"IQDF";"FlexShares International Quality Dividend Index Fund";"USD"
"IQDG";"WisdomTree International Quality Dividend Growth Fund";"USD"
"IQDY";"FlexShares International Quality Dividend Dynamic Index Fund";"USD"
"IQIN";"IQ 500 International ETF";"USD"
"IQLT";"iShares Edge MSCI Intl Quality Factor ETF";"USD"
"IQQY";"iShares Core MSCI Europe UCITS ETF EUR ";"EUR"
"IQSI";"IQ Candriam ESG International Equity ETF";"USD"
"IRBO";"iShares Robotics and Artificial Intelligence ETF";"USD"
"IRCP";"iShares € Corp Bond Interest Rate Hedged UCITS ETF EUR ";"EUR"
"IRCP";"iShares € Corp Bond Interest Rate Hedged UCITS ETF EUR ";"EUR"
"IRESF";"IShares Plc.";"USD"
"IRIRF";"iShares II plc.";"USD"
"IRRRF";"Ishares III Plc";"USD"
"ISACF";"Ishares III Plc";"USD"
"ISAPF";"IShares Plc.";"USD"
"ISCBF";"IShares Plc.";"USD"
"ISCF";"iShares Edge MSCI Multifactor Intl Small-Cap ETF";"USD"
"ISCKF";"iShares II plc.";"USD"
"ISCRF";"IShares Plc.";"USD"
"ISCXF";"IShares Plc.";"USD"
"ISDMF";"iShares II plc.";"USD"
"ISDS";"Invesco RAFI Strategic Developed ex-US Small Company ETF";"USD"
"ISDX";"Invesco RAFI Strategic Developed ex-US ETF";"USD"
"ISEM";"Invesco RAFI Strategic Emerging Markets ETF";"USD"
"ISERF";"IShares Plc.";"USD"
"ISESF";"Ishares Material Sector Index Fund";"USD"
"ISFLF";"iShares II plc.";"USD"
"ISGPF";"IShares Plc.";"USD"
"ISHAF";"Ishares Income Trust Sector Index Fd";"USD"
"ISHG";"iShares 1-3 Year International Treasury Bond ETF";"USD"
"ISHHF";"IShares Plc.";"USD"
"ISHUF";"IShares Plc.";"USD"
"ISHVF";"iShares II plc.";"USD"
"ISHXF";"iShares CDN DEX All Government Bond Index Fund";"USD"
"ISHYF";"iShares II plc.";"USD"
"ISJPF";"iShares II plc.";"USD"
"ISMCF";"iShares Trust";"USD"
"ISMD";"Inspire Small/Mid Cap Impact ETF";"USD"
"ISMUF";"iShares MSCI China Tracker";"USD"
"ISRA";"VanEck Vectors Israel ETF";"USD"
"ISRZF";"iShares II plc.";"USD"
"ISSGF";"IShares Plc.";"USD"
"ISSHF";"iShares II plc.";"USD"
"ISSSF";"Ishares III Plc";"USD"
"ISTB";"iShares Core 1-5 Year USD Bond ETF";"USD"
"ISTXF";"ISHARES USD TREASURY BD 1-3YR U";"USD"
"ISTXF";"IShares Plc.";"USD"
"ISXPF";"IShares Plc.";"USD"
"ISXXF";"IShares Plc.";"USD"
"ITA";"iShares U.S. Aerospace & Defense ETF";"USD"
"ITB";"iShares U.S. Home Construction ETF";"USD"
"ITBFF";"IShares Plc.";"USD"
"ITEQ";"BlueStar Israel Technology ETF";"USD"
"ITM";"VanEck Vectors AMT-Free Intermediate Municipal Index ETF";"MXN"
"ITM";"VanEck Vectors AMT-Free Intermediate Municipal Index ETF";"USD"
"ITOT";"iShares Core S&P Total U.S. Stock Market ETF";"USD"
"ITRYF";"IShares Plc.";"USD"
"ITSXF";"iUnits S&P/TSX Capped Financials Index Fund";"USD"
"ITW";"iShares MSCI Taiwan ETF";"AUD"
"IUKD";"iShares UK Dividend UCITS ETF GBP ";"GBp"
"IUS";"Invesco RAFI Strategic US ETF";"USD"
"IUSB";"iShares Core Total USD Bond Market ETF";"USD"
"IUSG";"iShares Core S&P U.S. Growth ETF";"USD"
"IUSS";"iShares MSCI Saudi Arabia Capped UCITS ETF USD ";"EUR"
"IUSS";"Invesco RAFI Strategic US Small Company ETF";"USD"
"IUSV";"iShares Core S&P U.S. Value ETF";"USD"
"IUTCF";"iShares S&P/TSX Global Gold Index ETF";"USD"
"IUTCF";"iUnits S&P/TSX Capped Gold Index Fund";"USD"
"IUTSF";"iUnits S&P/TSX 60 Index Fund";"USD"
"IVAL";"Alpha Architect International Quantitative Value ETF";"USD"
"IVE";"iShares S&P 500 Value ETF";"USD"
"IVE";"iShares MSCI EAFE ETF ";"AUD"
"IVLU";"iShares Edge MSCI Intl Value Factor ETF";"USD"
"IVOG";"Vanguard S&P Mid-Cap 400 Growth Index Fund ETF Shares";"USD"
"IVOL";"Quadratic Interest Rate Volatility and Inflation Hedge ETF New";"USD"
"IVOO";"Vanguard S&P Mid-Cap 400 Index Fund ETF Shares";"USD"
"IVOV";"Vanguard S&P Mid-Cap 400 Value Index Fund ETF Shares";"USD"
"IVSRF";"iShares II plc.";"USD"
"IVV";"iShares Trust - iShares Core S&P 500 ETF";"MXN"
"IVV";"iShares S&P 500 ETF";"AUD"
"IVV";"iShares Core S&P 500 ETF";"USD"
"IVW";"iShares S&P 500 Growth ETF";"USD"
"IWB";"iShares Russell 1000 ETF";"USD"
"IWC";"iShares Micro-Cap ETF";"USD"
"IWD";"iShares Russell 1000 Value ETF";"USD"
"IWF";"iShares Russell 1000 Growth ETF";"USD"
"IWL";"iShares Russell Top 200 ETF";"USD"
"IWM";"iShares Russell 2000 ETF";"USD"
"IWN";"iShares Trust - iShares Russell 2000 Value ETF";"MXN"
"IWN";"iShares Russell 2000 Value ETF";"USD"
"IWO";"iShares Russell 2000 Growth ETF";"USD"
"IWP";"iShares Russell Mid-Cap Growth ETF";"USD"
"IWR";"iShares Russell Mid-Cap ETF";"USD"
"IWS";"iShares Russell Mid-Cap Value ETF";"USD"
"IWV";"iShares Russell 3000 ETF";"USD"
"IWX";"iShares Russell Top 200 Value ETF";"USD"
"IWY";"iShares Russell Top 200 Growth ETF";"USD"
"IXC";"iShares Global Energy ETF";"USD"
"IXC";"iShares Global Energy ETF";"MXN"
"IXG";"iShares Global Financials ETF";"USD"
"IXJ";"iShares Global Healthcare ETF";"USD"
"IXJ";"iShares Global Healthcare ETF ";"AUD"
"IXN";"iShares Global Tech ETF";"USD"
"IXN";"iShares Global Tech ETF";"MXN"
"IXP";"iShares Global Comm Services ETF";"USD"
"IXUS";"iShares Trust - iShares Core MSCI Total International Stock ETF";"MXN"
"IXUS";"iShares Core MSCI Total International Stock ETF";"USD"
"IYC";"iShares U.S. Consumer Services ETF";"USD"
"IYC";"iShares Trust - iShares U.S. Consumer Services ETF";"MXN"
"IYE";"iShares U.S. Energy ETF";"USD"
"IYF";"iShares U.S. Financials ETF";"USD"
"IYG";"iShares U.S. Financial Services ETF";"MXN"
"IYG";"iShares U.S. Financial Services ETF";"USD"
"IYH";"iShares U.S. Healthcare ETF";"USD"
"IYJ";"iShares U.S. Industrials ETF";"USD"
"IYK";"iShares U.S. Consumer Goods ETF";"USD"
"IYLD";"iShares Morningstar Multi-Asset Income ETF";"USD"
"IYM";"iShares U.S. Basic Materials ETF";"USD"
"IYR";"iShares Trust - iShares U.S. Real Estate ETF";"MXN"
"IYR";"iShares U.S. Real Estate ETF";"USD"
"IYT";"iShares Transportation Average ETF";"USD"
"IYW";"iShares U.S. Technology ETF";"USD"
"IYW";"iShares U.S. Technology ETF";"MXN"
"IYY";"iShares Dow Jones U.S. ETF";"USD"
"IYZ";"iShares U.S. Telecommunications ETF";"USD"
"IZRL";"ARK Israel Innovative Technology ETF";"USD"
"JAGG";"JPMorgan U.S. Aggregate Bond ETF";"USD"
"JCPB";"JPMorgan Core Plus Bond ETF";"USD"
"JDIV";"JPMorgan U.S. Dividend ETF";"USD"
"JDST";"Direxion Daily Junior Gold Miners Index Bear 3X Shares";"USD"
"JETS";"U.S. Global Jets ETF";"USD"
"JHCS";"John Hancock Multifactor Media and Communications ETF";"USD"
"JHEM";"John Hancock Multifactor Emerging Markets ETF";"USD"
"JHMA";"John Hancock Exchange-Traded Fund Trust - John Hancock Multifactor Materials ETF";"USD"
"JHMC";"John Hancock Multifactor Consumer Discretionary ETF";"USD"
"JHMD";"John Hancock Multifactor Developed International ETF";"USD"
"JHME";"John Hancock Exchange-Traded Fund Trust - John Hancock Multifactor Energy ETF";"USD"
"JHMF";"John Hancock Multifactor Financials ETF";"USD"
"JHMH";"John Hancock Multifactor Health Care ETF";"USD"
"JHMI";"John Hancock Exchange-Traded Fund Trust - John Hancock Multifactor Industrials ETF";"USD"
"JHML";"John Hancock Multifactor Large Cap ETF";"USD"
"JHMM";"John Hancock Multifactor Mid Cap ETF";"USD"
"JHMS";"John Hancock Exchange-Traded Fund Trust - John Hancock Multifactor Consumer Staples ETF";"USD"
"JHMT";"John Hancock Multifactor Technology ETF";"USD"
"JHMU";"John Hancock Exchange-Traded Fund Trust - John Hancock Multifactor Utilities ETF";"USD"
"JHSC";"John Hancock Multifactor Small Cap ETF";"USD"
"JIGB";"JPMorgan Corporate Bond Research Enhanced ETF";"USD"
"JJG";"iPath Series B Bloomberg Grains Subindex Total Return ETN";"USD"
"JKD";"iShares Morningstar Large-Cap ETF";"USD"
"JKE";"iShares Morningstar Large-Cap Growth ETF";"USD"
"JKF";"iShares Morningstar Large-Cap Value ETF";"USD"
"JKG";"iShares Morningstar Mid-Cap ETF";"USD"
"JKH";"iShares Morningstar Mid-Cap Growth ETF";"USD"
"JKI";"iShares Morningstar Mid-Cap Value ETF";"USD"
"JKJ";"iShares Morningstar Small-Cap ETF";"USD"
"JKK";"iShares Morningstar Small-Cap Growth ETF";"USD"
"JKL";"iShares Morningstar Small-Cap Value ETF";"USD"
"JMBS";"Janus Henderson Mortgage-Backed Securities ETF";"USD"
"JMIN";"JPMorgan U.S. Minimum Volatility ETF";"USD"
"JMOM";"JPMorgan U.S. Momentum Factor ETF";"USD"
"JMPNL";"JMP Group LLC - 7.25% Senior No";"USD"
"JMST";"JPMorgan Ultra-Short Municipal Income ETF";"USD"
"JMUB";"JPMorgan Municipal ETF";"USD"
"JNK";"SPDR Series Trust - SPDR Bloomberg Barclays High Yield Bond ETF";"MXN"
"JNK";"SPDR Bloomberg Barclays High Yield Bond ETF";"USD"
"JNUG";"Direxion Daily Junior Gold Miners Index Bull 3X Shares";"USD"
"JO";"iPath Series B Bloomberg Coffee Subindex Total Return ETN";"USD"
"JOYY";"Infusive Compounding Global Equities ETF";"USD"
"JPED";"JPMorgan Event Driven ETF";"USD"
"JPEM";"JPMorgan Diversified Return Emerging Markets Equity ETF";"USD"
"JPEU";"J.P. Morgan Exchange-Traded Fund Trust - JPMorgan Diversified Return Europe Equity ETF";"USD"
"JPGE";"JPMorgan Diversified Return Global Equity ETF";"USD"
"JPHF";"JPMorgan Diversified Alternative ETF";"USD"
"JPHY";"JPMorgan High Yield Research Enhanced ETF";"USD"
"JPIN";"JPMorgan Diversified Return International Equity ETF";"USD"
"JPMB";"JPMorgan USD Emerging Markets Sovereign Bond ETF";"USD"
"JPMB";"JPMorgan ETFs ";"EUR"
"JPME";"JPMorgan Diversified Return U.S. Mid Cap Equity ETF";"USD"
"JPMF";"JPMorgan ETFs ";"EUR"
"JPMF";"JPMorgan Managed Futures Strategy ETF";"USD"
"JPMF";"JPMorgan ETFs ";"USD"
"JPMV";"Ossiam Japan Minimum Variance NR UCITS ETF 1C ";"EUR"
"JPMV";"iShares Edge MSCI Min Vol Japan ETF";"USD"
"JPN";"Lyxor Japan ";"EUR"
"JPN";"Lyxor Japan ";"EUR"
"JPN";"Xtrackers Japan JPX-Nikkei 400 Equity ETF";"USD"
"JPNL";"Direxion Daily Japan Bull 3X Shares";"USD"
"JPSE";"JPMorgan Diversified Return U.S. Small Cap Equity ETF";"USD"
"JPST";"JPMorgan Ultra-Short Income ETF";"USD"
"JPST";"JPMorgan ETFs ";"EUR"
"JPUS";"JPMorgan Diversified Return U.S. Equity ETF";"USD"
"JPXN";"iShares JPX-Nikkei 400 ETF";"USD"
"JPXN";"iShares Trust - iShares JPX-Nikkei 400 ETF";"MXN"
"JQUA";"JPMorgan U.S. Quality Factor ETF";"USD"
"JSMD";"Janus Henderson Small/Mid Cap Growth Alpha ETF";"USD"
"JSML";"Janus Henderson Small Cap Growth Alpha ETF";"USD"
"JUST";"Goldman Sachs JUST U.S. Large Cap Equity ETF";"USD"
"JVAL";"JPMorgan U.S. Value Factor ETF";"USD"
"JXI";"iShares Global Utilities ETF";"USD"
"KALL";"KraneShares MSCI All China Index ETF";"USD"
"KARS";"KraneShares Electric Vehicles and Future Mobility Index ETF";"USD"
"KBA";"KraneShares MSCI China A Share UCITS ETF USD";"USD"
"KBA";"KraneShares Bosera MSCI China A ETF";"USD"
"KBE";"SPDR S&P Bank ETF";"MXN"
"KBE";"SPDR S&P Bank ETF";"USD"
"KBWB";"Invesco KBW Bank ETF";"USD"
"KBWD";"Invesco KBW High Dividend Yield Financial ETF";"USD"
"KBWP";"Invesco KBW Property & Casualty Insurance ETF";"USD"
"KBWR";"Invesco KBW Regional Banking ETF";"USD"
"KBWY";"Invesco KBW Premium Yield Equity REIT ETF";"USD"
"KCCB";"KraneShares CCBS China Corporate High Yield Bond USD Index ETF";"USD"
"KCE";"SPDR S&P Capital Markets ETF";"USD"
"KCNY";"KraneShares E Fund China Commercial Paper ETF";"USD"
"KEMQ";"KraneShares FTSE Emerging Markets Consumer Technology Index ETF";"USD"
"KEMX";"KraneShares MSCI Emerging Markets ex China Index ETF";"USD"
"KEYS";"Amun Bitwise Select 10 Lrg Cp Crypto ETN";"USD"
"KFYP";"KraneShares CICC China Leaders 100 Index ETF";"USD"
"KGRN";"KraneShares MSCI China Environment Index ETF";"USD"
"KIE";"SPDR S&P Insurance ETF";"MXN"
"KIE";"SPDR S&P Insurance ETF";"USD"
"KJAN";"Innovator Russell 2000 Power Buffer ETF January";"USD"
"KLCD";"KFA Large Cap Quality Dividend Index ETF";"USD"
"KLDW";"Knowledge Leaders Developed World ETF";"USD"
"KMED";"KraneShares Emerging Markets Healthcare Index ETF";"USD"
"KNG";"CBOE Vest S&P 500 Dividend Aristocrats Target Income Index ETF";"USD"
"KNOW";"Direxion All Cap Insider Sentiment Shares";"USD"
"KOCT";"Innovator Russell 2000 Power Buffer ETF";"USD"
"KOIN";"Innovation Shares NextGen Protocol ETF";"USD"
"KOL";"VanEck Vectors Coal ETF";"USD"
"KOLD";"ProShares UltraShort Bloomberg Natural Gas";"USD"
"KOMP";"SPDR S&P Kensho New Economies Composite ETF";"USD"
"KORP";"American Century Diversified Corporate Bond ETF";"USD"
"KORU";"Direxion Daily South Korea Bull 3X Shares";"USD"
"KRE";"SPDR S&P Regional Banking ETF";"MXN"
"KRE";"SPDR S&P Regional Banking ETF";"USD"
"KRMA";"Global X Conscious Companies ETF";"USD"
"KSA";"iShares MSCI Saudi Arabia ETF";"USD"
"KSCD";"KFA Small Cap Quality Dividend Index ETF";"USD"
"KSM";"K2 Australian Small Cap Fund";"AUD"
"KURE";"KraneShares MSCI All China Health Care Index ETF";"USD"
"KWEB";"Kraneshares Icav - Kraneshares Csi China Internet UCITS ETF";"USD"
"KWEB";"KraneShares CSI China Internet ETF USD";"USD"
"KWEB";"KraneShares CSI China Internet ETF";"USD"
"KXI";"iShares Global Consumer Staples ETF";"USD"
"KXI";"iShares Trust - iShares Global Consumer Staples ETF";"MXN"
"LABD";"Direxion Daily S&P Biotech Bear 3X Shares";"USD"
"LABU";"Direxion Daily S&P Biotech Bull 3X Shares";"USD"
"LACK";"Direxion Daily Cnsmr Staples Bear 3XShrs";"USD"
"LBJ";"Direxion Daily Latin America Bull 3X Shares";"USD"
"LBRT";"WisdomTree Brent Crude Oil 2x Daily Leveraged";"USD"
"LBRT";"WisdomTree Brent Crude Oil 2x Daily Leveraged";"EUR"
"LCR";"Leuthold Core ETF";"USD"
"LDRS";"Innovator IBD ETF Leaders ETF";"USD"
"LDSF";"First Trust Low Duration Strategic Focus ETF";"USD"
"LDUR";"PIMCO Enhanced Low Duration Active Exchange-Traded Fund";"USD"
"LEAD";"Reality Shares ETF Trust - Reality Shares DIVCON Leaders Dividend ETF";"USD"
"LEGR";"First Trust Indxx Innovative Transaction & Process UCITS ETF";"USD"
"LEGR";"First Trust Indxx Innovative Transaction & Process ETF";"USD"
"LEMB";"Lyxor iBoxx $ Liquid Emerging Markets Sovereign UCITS ETF - Dist";"USD"
"LEMB";"iShares, Inc. - iShares J.P. Morgan EM Local Currency Bond ETF";"MXN"
"LEMB";"iShares J.P. Morgan EM Local Currency Bond ETF";"USD"
"LEMB";"Lyxor iBoxx $ Liquid Emerging Markets Sovereign UCITS ETF - Dist";"USD"
"LEND";"Amplify CrowdBureau";"USD"
"LFEQ";"VanEck Vectors ETF Trust - VanEck Vectors NDR CMG Long/Flat Allocation ETF";"USD"
"LFIN";"Lyxor Index Fund - Lyxor STOXX Europe 600 Financial Services UCITS ETF";"EUR"
"LGH";"HCM Defender 500 Index ETF";"USD"
"LGLBF";"Gold Bullion Securities Limited - Gold Bullion Securities";"USD"
"LGLV";"SPDR SSGA US Large Cap Low Volatility Index ETF";"USD"
"LGOV";"First Trust Long Duration Opportunities ETF";"USD"
"LIFE";"Evolve Global Healthcare Enhanced Yield Fund Hedged Units";"CAD"
"LINK";"Evolve Blockchain ETF";"CAD"
"LIT";"Global X Lithium & Battery Tech ETF";"USD"
"LKOR";"FlexShares Credit-Scored US Long Corporate Bond Index Fund";"USD"
"LMBS";"First Trust Low Duration Opportunities ETF";"USD"
"LMHA";"Legg Mason, Inc.";"USD"
"LMLB";"ETRACS Monthly Pay 2xLeveraged ";"USD"
"LNAS";"ETFS Ultra Long Nasdaq 100 Hedge Fund";"AUD"
"LNGR";"Global X Longevity Thematic ETF";"USD"
"LOUP";"Innovator Loup Frontier Tech ETF";"USD"
"LOWC";"SPDR MSCI ACWI Low Carbon Target ETF";"USD"
"LPLA";"WisdomTree Platinum 2x Daily Leveraged";"EUR"
"LPLA";"WisdomTree Platinum 2x Daily Leveraged";"USD"
"LQD";"iShares iBoxx $ Investment Grade Corporate Bond ETF";"USD"
"LQDA";"iShares Public Limited Company - iShares $ Corp Bond UCITS ETF";"USD"
"LQDA";"iShares $ Corp Bond UCITS ETF USD ";"CHF"
"LQDA";"iShares $ Corp Bond UCITS ETF USD ";"EUR"
"LQDH";"iShares $ Corp Bond Interest Rate Hedged UCITS ETF USD ";"USD"
"LQDH";"iShares $ Corp Bond Interest Rate Hedged UCITS ETF USD ";"EUR"
"LQDH";"iShares Interest Rate Hedged Corporate Bond ETF";"USD"
"LQDI";"iShares Inflation Hedged Corporate Bond ETF";"USD"
"LRGE";"ClearBridge Large Cap Growth ESG ETF";"USD"
"LRGF";"iShares Edge MSCI Multifactor USA ETF";"USD"
"LSAF";"LeaderSharesTM AlphaFactor US Core Equity ETF";"USD"
"LSLT";"ETF Series Solutions - Salt Low truBeta US Market ETF";"USD"
"LSST";"Natixis Loomis Sayles Short Duration Income ETF";"USD"
"LTL";"ProShares Ultra Telecommunications";"USD"
"LTM";"Lyxor MSCI EM Latin America UCITS ETF Acc";"EUR"
"LTPZ";"PIMCO 15+ Year U.S. TIPS Index Exchange-Traded Fund";"USD"
"LTSF";"Ladenburg Thalmann Financial Services Inc. 7.00% SN NT 28";"USD"
"LTSK";"Ladenburg Thalmann Financial Se";"USD"
"LTSL";"Ladenburg Thalmann Financial Services Inc. 6.50% NT 27";"USD"
"LVHD";"Legg Mason Low Volatility High Dividend ETF";"USD"
"LVHI";"Legg Mason International Low Volatility High Dividend ETF";"USD"
"LVUS";"Hartford Multifactor Low Volatility US Equity ETF";"USD"
"MAA";"MULTI-UNITS LUXEMBOURG - Lyxor EuroMTS Highest Rated Macro-Weighted Govt Bond ";"EUR"
"MAAX";"VanEck Vectors Municipal Allocation ETF";"USD"
"MAGA";"Point Bridge GOP Stock Tracker ETF";"USD"
"MARB";"First Trust Vivaldi Merger Arbitrage ETF";"USD"
"MATW";"Lyxor MSCI World Materials TR UCITS ETF - C-EUR";"EUR"
"MBB";"iShares MBS ETF";"USD"
"MBSD";"FlexShares Disciplined Duration MBS Index Fund";"USD"
"MCEF";"First Trust Municipal CEF Income Opportunity ETF";"USD"
"MCHI";"iShares MSCI China ETF";"USD"
"MCHI";"iShares Trust - iShares MSCI China ETF";"MXN"
"MCRO";"IQ Hedge Macro Tracker ETF";"USD"
"MCX";"Medley Capital Corporation 6.50 NT 013021";"USD"
"MDIV";"First Trust Multi-Asset Diversified Income Index Fund";"USD"
"MDLQ";"Medley LLC NT 24";"USD"
"MDY";"SPDR S&P MIDCAP 400 ETF Trust";"USD"
"MDYG";"SPDR S&P 400 Mid Cap Growth ETF";"USD"
"MDYV";"SPDR S&P 400 Mid Cap Value ETF";"USD"
"MEAR";"iShares Short Maturity Municipal Bond ETF";"USD"
"MEXX";"Direxion Daily MSCI Mexico Bull 3X Shares Direxion Daily MSCI Mexico Bull 3";"USD"
"MFDX";"PIMCO RAFI Dynamic Multi-Factor International Equity ETF";"USD"
"MFEM";"PIMCO RAFI Dynamic Multi-Factor Emerging Markets Equity ETF";"USD"
"MFMS";"MFAM Small-Cap Growth ETF";"USD"
"MFT";"Mackenzie Floating Rate Income ETF";"CAD"
"MFUS";"PIMCO RAFI Dynamic Multi-Factor U.S. Equity ETF";"USD"
"MGC";"Vanguard Mega Cap Index Fund ETF Shares";"USD"
"MGE";"Magellan Global Equities Fund";"AUD"
"MGK";"Vanguard Mega Cap Growth Index Fund ETF Shares";"USD"
"MGK";"Vanguard Mega Cap Growth Index Fund ETF Shares";"MXN"
"MGV";"Vanguard Mega Cap Value Index Fund ETF Shares";"USD"
"MHG";"Magellan Global Equities Fund - Currency Hedged";"AUD"
"MHLA";"Maiden Holdings, Ltd. 6.625 NT 2046";"USD"
"MICH";"Magellan Infrastructure Fund - Currency Hedged";"AUD"
"MIDD";"iShares FTSE 250 UCITS ETF GBP ";"GBp"
"MIDU";"Direxion Daily Mid Cap Bull 3X Shares";"USD"
"MILN";"Global X Millennials Thematic ETF";"USD"
"MINC";"AdvisorShares Newfleet Multi-Sector Income ETF";"USD"
"MIND";"Horizons Active A.I. Global Equity ETF";"CAD"
"MINT";"Manulife Multifactor Developed International Index ETF ";"CAD"
"MINT";"PIMCO US Dollar Short Maturity Source UCITS ETF";"EUR"
"MINT";"PIMCO Fixed Income Source ETFs plc - PIMCO US Dollar Short Maturity Source UCITS ETF";"USD"
"MINT";"PIMCO Enhanced Short Maturity Active Exchange-Traded Fund";"USD"
"MJ";"ETFMG Alternative Harvest ETF";"USD"
"MJJ";"MicroSectors Cannabis ETNs";"USD"
"MJO";"MicroSectors Cannabis 2X Leveraged ETNs";"USD"
"MJP";"HSBC MSCI JAPAN UCITS ETF";"EUR"
"MKAX";"Montaka Global Extension Fund Quoted Managed Hedge Fund";"AUD"
"MLN";"VanEck Vectors AMT-Free Long Municipal Index ETF";"USD"
"MLPA";"Global X MLP ETF";"USD"
"MLPG";"UBS ETRACS Alerian Natural Gas MLP Index ETN";"USD"
"MLPI";"L&G US Energy Infrastructure MLP UCITS ETF";"EUR"
"MLPI";"L&G US Energy Infrastructure MLP UCITS ETF";"CHF"
"MLPI";"Legal & General UCITS ETF Plc - L&G US Energy Infrastructure MLP UCITS ETF";"USD"
"MLPX";"Global X MLP & Energy Infrastructure ETF";"USD"
"MLPY";"Morgan Stanley Cushing MLP High Income Index ETN";"USD"
"MMIN";"IQ MacKay Shields Municipal Insured ETF";"USD"
"MMIT";"IQ MacKay Shields Municipal Intermediate ETF";"USD"
"MMS";"Lyxor Index Fund - Lyxor MSCI EMU Small Cap ";"EUR"
"MMS";"Lyxor Index Fund - Lyxor MSCI EMU Small Cap ";"EUR"
"MMTM";"SPDR S&P 1500 Momentum Tilt ETF";"USD"
"MNA";"IQ Merger Arbitrage ETF";"USD"
"MNS";"Royal Canadian Mint - Canadian Silver Reserves";"CAD"
"MOAT";"VanEck Vectors Morningstar Wide Moat ETF";"USD"
"MOAT";"VanEck Vectors ETF Trust - VanEck Vectors Morningstar Wide Moat ETF";"AUD"
"MOAT";"VanEck Vectors Morningstar US Wide Moat UCITS ETF";"USD"
"MOAT";"VanEck Vectors Morningstar US Wide Moat UCITS ETF";"CHF"
"MOAT";"VanEck Vectors Morningstar US Wide Moat UCITS ETF";"EUR"
"MOGB";"VanEck Vectors Morningstar US Wide Moat UCITS ETF";"GBP"
"MOGL";"Montgomery Global Equities Fund Managed Fund";"AUD"
"MOM";"AGFiQ U.S. Market Neutral Momentum Fund";"USD"
"MOO";"VanEck Vectors Agribusiness ETF";"USD"
"MORT";"VanEck Vectors Mortgage REIT Income ETF";"USD"
"MORT";"VanEck Vectors Mortgage REIT Income ETF";"MXN"
"MOTI";"VanEck Vectors Morningstar International Moat ETF";"USD"
"MOTO";"SmartETFs Smart Transportation & Technology ETF";"USD"
"MRCCL";"Monroe Capital Corporation - 5.";"USD"
"MSTR";"Morningstar International Shares Active ETF";"AUD"
"MTA";"MULTI-UNITS LUXEMBOURG - Lyxor EuroMTS 1-3Y Investment Grade ";"EUR"
"MTA";"Lyxor Euro Government Bond 1-3Y DR UCITS ETF";"EUR"
"MTB";"MULTI-UNITS LUXEMBOURG - Lyxor EuroMTS 3-5Y INVESTMENT GRADE ";"EUR"
"MTE";"Lyxor Euro Government Bond 10-15Y DR UCITS ETF";"EUR"
"MTE";"Lyxor Euro Government Bond 10-15Y DR UCITS ETF";"EUR"
"MTGP";"WisdomTree Mortgage Plus Bond Fund";"USD"
"MTH";"Lyxor Index Fund - Lyxor Ultra Long Duration Euro Govt FTSE MTS 25+Y ";"EUR"
"MTUM";"iShares Edge MSCI USA Momentum Factor ETF";"USD"
"MTUM";"iShares Edge MSCI USA Momentum Factor ETF";"MXN"
"MTX";"MULTI-UNITS LUXEMBOURG - Lyxor EuroMTS All-Maturity Investment Grade ";"EUR"
"MTX1";"Lyxor Euro Government Bond DR UCITS ETF";"EUR"
"MUB";"Mackenzie Unconstrained Bond ETF";"CAD"
"MUB";"iShares National Muni Bond ETF";"USD"
"MUNI";"PIMCO Intermediate Municipal Bond Active Exchange-Traded Fund";"USD"
"MUS";"HSBC MSCI USA UCITS ETF";"EUR"
"MUST";"Columbia Multi-Sector Municipal Income ETF";"USD"
"MUTE";"Direxion Daily Communication Services Index Bear 3X Shares";"USD"
"MVCD";"MVC Capital, Inc. 6.25% Senior ";"USD"
"MVIN";"Natixis Seeyond International Minimum Volatility ETF";"USD"
"MVR";"VanEck Vectors Australian Resources ETF";"AUD"
"MVV";"ProShares Ultra MidCap400";"USD"
"MXDU";"Nationwide Maximum Diversification U.S. Core Equity ETF";"USD"
